{
  "id": "SRC-COL-BANREP-HISTORIAS-OFRENDAS-2013",
  "title": "Historias de ofrendas muiscas",
  "source_type": "institutional",
  "creator": "Banco de la República, Museo del Oro / UCL Institute of Archaeology",
  "date": "2013",
  "language": "Spanish",
  "locator": "https://babel.banrepcultural.org/digital/collection/p17054coll18/id/400/",
  "provenance": "Banco de la República digital collection; museum research publication covering Muisca offerings, Guatavita, metallurgy, rituals, and the Pasca raft.",
  "quality": "high",
  "notes": [
    "Used as institutional research context, not as a substitute for claim-specific archaeological evidence where stronger sources exist."
  ]
}
