{
  "id": "SRC-GBR-LINDOW-BRITISH-MUSEUM-REVIEW",
  "title": "Looking Death in the Face: different attitudes towards bog bodies and their display with a focus on Lindow Man",
  "source_type": "museum",
  "creator": "British Museum",
  "date": "2015",
  "language": "en",
  "locator": "https://www.britishmuseum.org/sites/default/files/2019-11/Regarding-the-Dead_02102015.pdf",
  "provenance": "British Museum publication reviewing Lindow Man's discovery, dating, injuries, conservation, display history, and disputed ritual-sacrifice interpretation.",
  "quality": "high",
  "notes": ["Used to separate observed violent death and bog deposition from disputed ritual-sacrifice interpretations."]
}