{
  "id": "SRC-GBR-ESA-HALLEY-1066",
  "title": "24 April — Comet Halley and 1066",
  "source_type": "institutional",
  "creator": "European Space Agency",
  "date": null,
  "language": "English",
  "locator": "https://www.esa.int/Science_Exploration/Space_Science/24_April",
  "provenance": "ESA Space Science historical chronology entry for 24 April.",
  "quality": "high",
  "notes": [
    "Records a comet appearance on 24 April 1066 and connects it with the later Bayeux Tapestry depiction and medieval omen interpretation."
  ]
}
