{
  "id": "SRC-GBR-BAYEUX-HALLEY-1066",
  "title": "Explore the Bayeux Tapestry online",
  "source_type": "museum",
  "creator": "Bayeux Museum",
  "date": null,
  "language": "English",
  "locator": "https://www.bayeuxmuseum.com/en/the-bayeux-tapestry/discover-the-bayeux-tapestry/explore-online/",
  "provenance": "Official Bayeux Museum digital panorama and interpretive guide to the Bayeux Tapestry.",
  "quality": "high",
  "notes": [
    "The museum identifies the celestial body shown in the tapestry as Halley's Comet passing across the English sky in spring 1066."
  ]
}
