{
  "id": "SRC-COL-BANREP-BALSA-MUISCA",
  "title": "Balsa muisca",
  "source_type": "museum",
  "creator": "Banco de la República / Museo del Oro",
  "date": null,
  "language": "Spanish",
  "locator": "https://enciclopedia.banrepcultural.org/Balsa_muisca",
  "provenance": "Banco de la República cultural encyclopedia / Museo del Oro collection reference for object O00015.",
  "quality": "high",
  "notes": [
    "Documents the 1969 Pasca discovery and votive character of the Muisca raft.",
    "Describes the Guatavita investiture scene as a traditional interpretation; the raft was not found at Lake Guatavita."
  ]
}
