{
  "id": "SRC-JERUSALEM-MET-WORLD-BETWEEN-EMPIRES",
  "title": "The World between Empires: Art and Identity in the Ancient Middle East — Judaea",
  "source_type": "museum",
  "creator": "The Metropolitan Museum of Art",
  "date": "2019",
  "language": "English",
  "locator": "https://resources.metmuseum.org/resources/metpublications/pdf/The_World_between_Empires_Art_and_Identity_in_the_Ancient_Middle_East.pdf",
  "provenance": "Metropolitan Museum scholarly catalogue contextualizing the Roman response to the Judaean revolt, the 70 CE siege of Jerusalem, destruction of the Temple, and Josephus as a critical ancient source.",
  "quality": "high",
  "notes": [
    "Useful independent modern synthesis alongside the near-contemporary Josephus account.",
    "Also describes the later Arch of Titus as commemoration of the Flavian victory and Temple spoils."
  ]
}
