{
  "id": "SRC-IDN-NOAA-KRAKATAU-1883",
  "title": "On This Day: Historic Krakatau Eruption of 1883",
  "source_type": "institutional",
  "creator": "NOAA National Centers for Environmental Information",
  "date": "2017-08-26; updated 2023-08-16",
  "language": "English",
  "locator": "https://www.ncei.noaa.gov/news/day-historic-krakatau-eruption-1883",
  "provenance": "NOAA/NCEI historical natural-hazards summary.",
  "quality": "high",
  "notes": [
    "Documents the August 1883 eruptive sequence, island collapse, destructive tsunamis, fatalities, and global atmospheric-pressure observations."
  ]
}
