{
  "id": "SRC-NOR-OSEBERG-VIKING-HERITAGE",
  "title": "The Oseberg find — in short",
  "source_type": "institutional",
  "creator": "Oseberg Viking Heritage Foundation",
  "date": "2026-08-19",
  "language": "en",
  "locator": "https://osebergvikingarv.no/eng/the-oseberg-ship/the-oseberg-find-in-short/",
  "provenance": "Oseberg-focused heritage institution overview of the 1904 excavation, ship, associated objects, and two women buried with the ship; its interpretation pages explicitly retain uncertainty around the women's identities.",
  "quality": "medium",
  "notes": ["Used for burial context and the existence of two women, not as authority for a specific ritual or historical identity."]
}