{
  "id": "SRC-COL-CAMBRIDGE-GUATAVITA-2024",
  "title": "El Dorado Offerings in Lake Guatavita: A Muisca Ritual Archaeological Site",
  "source_type": "peer_reviewed_scholarship",
  "creator": "Juan Pablo Quintero-Guzmán",
  "date": "2024-06 (published online 2023-08-23)",
  "language": "English / Spanish abstract",
  "locator": "https://www.cambridge.org/core/journals/latin-american-antiquity/article/el-dorado-offerings-in-lake-guatavita-a-muisca-ritual-archaeological-site/CCCA4FF23E90BA66FD0A1353C353434F",
  "provenance": "Latin American Antiquity 35(2), pp. 483–499; Cambridge University Press; author affiliated with Banco de la República, Museo del Oro.",
  "quality": "high",
  "notes": [
    "Reports results of a 2009 archaeological survey around Lake Guatavita.",
    "Material distribution supports a shrine with small-scale offerings rather than conspicuous mass celebrations."
  ]
}
