{
  "id": "SRC-GBR-BATH-ROMAN-BATHS-CURSE-TABLETS",
  "title": "Roman curse tablets",
  "source_type": "museum",
  "creator": "Roman Baths, Bath & North East Somerset Council",
  "date": null,
  "language": "en",
  "locator": "https://www.romanbaths.co.uk/roman-curse-tablets",
  "provenance": "Official Roman Baths collection page describing the approximately 130 inscribed lead or pewter tablets, their second-to-late-fourth-century dating, and deposition in the Sacred Spring.",
  "quality": "high",
  "notes": ["The source describes them as personal/private prayers and notes that many concern perceived injustice; LEGEND does not reduce all tablets to one motive."]
}