{
  "id": "SRC-IDN-NOAA-KRAKATAU-TRAVEL-TIME",
  "title": "Tsunami Travel Time Maps — August 27, 1883 Krakatau",
  "source_type": "institutional",
  "creator": "NOAA National Centers for Environmental Information",
  "date": null,
  "language": "English",
  "locator": "https://www.ncei.noaa.gov/products/natural-hazards/tsunamis-earthquakes-volcanoes/tsunamis/travel-time-maps",
  "provenance": "NOAA/NCEI tsunami travel-time reference for the August 27, 1883 Krakatau event.",
  "quality": "high",
  "notes": [
    "Distinguishes direct tsunami propagation from remote water-level disturbances plausibly excited by atmospheric gravity waves where continental shadowing precluded direct tsunami travel."
  ]
}
